<!ELEMENT students (student+)>
<!ELEMENT student (id,name,(email|phone)*,course)>
<!ELEMENT id (#PCDATA)>
<!ELEMENT name (#PCDATA)>
<!ELEMENT email (#PCDATA)>
<!ELEMENT phone (#PCDATA)>
<!ELEMENT course (#PCDATA)>
<!ATTLIST student semester  ID #IMPLIED>
